Text,Difficulty
"Lors du Congrès organisé en novembre 1830, une très large majorité des cent quatre-vingt-huit membres se prononce pour l'établissement d'une monarchie constitutionnelle",A2
Après avoir sollicité le jeune fils du nouveau roi des Français Louis-Philippe ler - qui refuse par crainte de nouvelles tensions internationales - les Belges se rabattent sur le prince anglo-allemand Léopold de Saxe- Cobourg,B2
Il prête serment le 21 juillet 1831 et devient roi sous le nom de Léopold ler,A2
"Malgré la reconnaissance par les grandes puissances de ce nouvel état souverain, Guillaume ler n'accepte pas la situation",B2
Il faudra en effet attendre 1839 pour que les Pays-Bas reconnaissent officiellement l'indépendance belge en signant à Londres le traité des XXIV articles,B1
Vous ne pouvez pas commencer votre journée sans votre bol de chocolat chaud ?,A2
Ce rendez-vous des gourmands et des passionnés de chocolat a lieu tous les ans entre fin octobre et début novembre à Paris,B1
Pile au moment où on a le plus besoin de réconfort,A2
"Ce ne sont pas moins de 20 000 mètres carré dédiés au cacao qui vous attendent cette année, avec plus de 500 participants venus de 60 pays différents - parmi lesquels chocolatiers, pâtissiers, confiseurs et professionnels de l'industrie du chocolat, mais aussi pays producteurs, grands chefs, designers et experts en cacao - tous réunis pour faire découvrir au public les richesses de la célèbre fève",B1
"Le Salon du Chocolat célèbre les sources du chocolat, en mettant en lumière les pays producteurs, les terres du cacao et leur patrimoine culturel",B1
Les International Cocoa Awards mettent ainsi à l'honneur le travail des planteurs et les grands crus,B1
"Mais pour les visiteurs et les professionnels, c'est également l'occasion de découvrir les dernières innovations, et surtout de goûter les créations des chefs pâtissiers et chocolatiers",B1
"Vous pourrez, entre autres, participer à des séances dégustations, faire dédicacer vos livres de recette favoris par leur auteur à l'espace librairie, ou encore admirer les 10 créations inédites signées d'artistes de renom sur le thème du chocolat",B1
"Et pour les enfants, des ateliers de pâtisserie se dérouleront chaque jour tout au long de la journée",A2
"Enfin, ne manquez surtout pas le défilé de robes en chocolat qui reste l'un des temps forts du salon, mêlant modèles historiques et créations inédites",A2
"En plus de toutes ces activités, le Salon du Chocolat est également l'endroit rêvé pour découvrir et acheter les chocolats de nombreux artisans chocolatiers du monde entier, réunis en un seul lieu à Paris",B1
Vous n'envisagez pas la vie sans votre tablette quotidienne,A2
Alors le Salon du Chocolat est l'événement à ne pas manquer,A2
"Aujourd'hui, je suis très occupé",A2
"D'abord, je dois aller à la boulangerie pour acheter du pain et des croissants",A2
Puis je vais passer à la poste pour envoyer un colis à ma grand-mère,A2
"Ensuite, je vais faire mes courses au supermarché où je vais acheter des fruits et des légumes",A2
"Vers midi, je vais rejoindre mon ami Pierre au restaurant italien pour déjeuner avec lui",A2
Je suis content car je ne le vois pas souvent,A2
"En plus, c'est mon restaurant préféré, donc je vais me régaler",A2
"L'après-midi, j'ai encore beaucoup de choses à faire",A2
"Je veux trouver un cadeau d'anniversaire pour ma copine, donc je vais aller au centre commercial",A2
Il y a un nouveau film avec son acteur préféré,A2
"Et après le film, je l'emmène dîner dans un restaurant romantique",A2
"Samedi dernier, j'ai passé la journée à Paris avec mon frère",A2
"Comme il faisait très beau, nous nous sommes promenés le long de la Seine",A2
"Puis mon frère voulait voir la tour Eiffel, alors nous y sommes allés",A2
Nous avons aussi visité le musée du Louvre,A2
C'était très intéressant,A2
"Après ça, nous étions un peu fatigués",A2
"Pour nous reposer, nous avons bu un verre en terrasse",A2
"Le soir, nous avons mangé dans un excellent restaurant",A2
"J'ai pris du poisson avec du riz, et mon frère a choisi un simple steak-frites",A2
"Pour finir, nous sommes allés au théâtre : la pièce était hilarante",A2
Nous avons beaucoup ri,A2
De longues heures s’enchaînent pendant lesquelles Alice et ses camarades apprennent de nouvelles choses,B1
"En France, Noël est un moment important",B1
"Ainsi, les salons se parent de bougies et de sapins",B1
Certaines familles ont pour tradition de déposer des biscuits et un verre de lait près du sapin pour remercier le père noël.,B1
Les habitants (villes comme campagnes) décorent leurs habitations et achètent des calendriers de l'avant,B1
"En général, les français optent pour des sapins en pot afin de prolonger la magie du moment",B1
L'arbre odorant est paré de guirlandes et de boules tandis qu'une étoile chatoyante est ajoutée sur la cime,B2
Bien entendu les cadeaux de Noël seront déposés uniquement le 24 décembre au soir afin de permettre le déballage le lendemain matin,B1
Pâques est une fête catholique célébrée le 21 avril,B1
Elle commémore la résurrection de Jésus mais fête aussi le printemps,B1
"Tandis que les jonquilles fleurissent, les parents dissimulent du chocolat dans le jardin afin de célébrer Pâques",B1
Petits comme grands peuvent ainsi partir à la chasse à l’œuf,B1
"Traditionnellement les chocolats sont sous forme d’œufs mais aussi d'animaux comme des poussins, lapins, moutons",B1
Certains familles décorent les œufs durs en peignant leurs coquilles avec des teintes vertes ou rouges,B1
La maison de Ben est grande,B1
Il y a beaucoup de pièces,A2
"Au rez-de-chaussée, il y a un salon avec un piano, une salle-à-manger, une cuisine spacieuse et jaune et une salle de bain",B1
"Il a fait construire en plus une belle véranda contenant une bibliothèque, pour profiter du soleil et d'une vue sur le jardin",B1
"Au sous-sol, il y a une cave, pour ranger le vin",B1
"Au premier étage, il y a trois chambres",B1
"Au deuxième étage, il y a un bureau et deux chambres, dont la sienne",B1
"Dans le bureau, il y a un vélo d'appartement, des haltères et un stepper",B1
"Le jardin est long et étroit, il y a une balançoire au fond et un barbecue, proche de la terrasse, sur laquelle est posée un transat",B1
Des chats viennent souvent chasser les feuilles qui volent au vent,B1
"Avec les prévisions météo, on peut savoir quel temps il fera le soir, le lendemain ou dans la semaine",B1
"Quand il y a un grand soleil sur la carte, il fera chaud sur la région",B1
"Quand la météo indique un soleil avec des nuages, il y aura peu de soleil et il y aura souvent du vent",B1
Le temps sera gris,A2
"S’il y a des nuages avec de la pluie sur la carte, c’est qu’il va pleuvoir et qu’il y a des risques de tempête ou de grêle",B1
"Si de la pluie tombe alors qu’il y a du soleil, vous pourrez sans doute observer un arc-en-ciel",B1
"Quand il y a des nuages avec de la neige qui tombe, c’est qu’il va neiger et qu’il peut y avoir du brouillard, des risques de congélation, de la glace et que la température sera très basse",B1
"Lorsqu’il y a un éclair avec des nuages et de la pluie, il risque d’y avoir de la foudre et du tonnerre",B1
La tour Eiffel est le symbole de la ville de Paris,B1
Elle a été construite par Gustave Eiffel pour l’Exposition universelle de Paris de 1889,B1
La tour Eiffel mesure exactement 312 mètres de hauteur,B1
"Lorsqu’elle a été construite, la tour Eiffel était le monument le plus élevé du monde (elle l’est restée pendant quarante ans)",B1
"C’est un site touristique très important, environ 7 millions de touristes visitent la tour Eiffel chaque année",B1
"Au total, on estime que depuis sa construction plus de 300 millions de personnes ont visité la tour Eiffel",B1
"Du haut de la Tour Eiffel, on peut voir les principaux monuments de Paris",B1
"la cathédrale Notre-Dame, la tour Montparnasse et l’arc de triomphe",B1
On peut voir aussi le fleuve qui traverse la capitale,B1
La tour Eiffel est située sur le Champ-de-Mars,B1
C’est un parc où les gens viennent se promener en famille et entre amis,B1
"Tout en haut de la tour Eiffel, il y a des antennes qui émettent les programmes de radio et de télévision",B1
Il y a même des restaurants,A2
"Le corps humain comprend une tête, un tronc et quatre membres",B1
La tête se compose du visage et du crâne qui est recouvert de cheveux,B1
"Le visage comprend une oreille de chaque côté, deux yeux surmontés par les sourcils et un nez au centre",B1
"Puis, viennent la bouche et le menton",B1
Les dents se trouvent dans la bouche,B1
Le tronc est relié à la tête par le cou,B1
Il se compose du thorax et de l'abdomen encore appelé ventre,B1
La poitrine contient les deux poumons et le cœur,B1
Le ventre se trouve à la partie inférieure du tronc,B1
"Il renferme le foie, l’estomac, les reins et les intestins",B1
Ce sont des organes internes comme le cerveau qui est logé dans la tête,B1
Le dos forme la partie arrière du tronc,B1
Les membres sont au nombre de quatre,B1
"Un membre supérieur comprend un bras, un avant-bras et une main munie de cinq doigts",B1
Le bras est relié au tronc par l’épaule et à l’avant-bras par le coude,B1
"Un membre inférieur comprend une cuisse, une jambe et un pied qui a cinq orteils",B1
"Les articulations sont en haut la hanche, au milieu le genou en en bas la cheville",B1
Les vacances d'été en France durent 6 semaines et ont habituellement lieu entre Juillet et Septembre,B1
"En France, le début des vacances est souligné par les soldes d'été",B1
Il faut savoir que les étudiants comme les travailleurs attendent ces vacances avec impatiente,B1
La majorité des Français ne restent pas dans leur région durant les vacances d'été,B1
"Le sud du pays, l'Italie ou l'Espagne sont notamment les destinations touristiques les plus prisées des vacanciers en raison du climat perpétuellement froid dans le nord du pays",B1
"Toutefois, certaines personnes ne disposent pas d'un budget spécial pour financer ce type de détente",B1
Ils préfèrent alors rester à la maison et profitent du temps libre pour visiter leurs familles ou se balader en ville,B1
"Pour aller au travail, Marc porte une veste, un pantalon, une chemise et une belle cravate rouge",B1
Ses amis trouvent qu’il est très élégant avec son bracelet-montre doré et ses chaussures noires,B1
"Quand il doit rencontrer un client important, Marc n’hésite pas à s’habiller sobrement",B1
Il met son plus beau costume et son chapeau,B1
Il se sent plus à l’aise avec une tenue vestimentaire classique,B1
Sa secrétaire Lili porte des lunettes,A2
Elle adore mettre sa jupe à fleurs et un chemisier assorti lorsqu’il fait beau,B1
"En hiver, elle ne sort jamais sans son parapluie et son écharpe",B1
"Elle préfère aussi mettre un pull, des chaussettes en laine, des bottes et ses gants pour ne pas avoir froid aux doigts",B1
"Parfois, elle exhibe un joli collier en perles autour du cou qui lui donne une allure très attrayante",B1
"En été, lorsqu’il fait chaud, Lili et Marc vont à plage pendant le weekend",B1
"Ils mettent des lunettes de soleil, une belle casquette, un T-shirt, des shorts et des sandales",B1
Ils aiment passer des journées ensemble au bord de la mer,B1
"Je t’écris de France, où je vis avec ma famille depuis deux mois",B1
"Nous allons bien, nous habitons dans une petite maison ancienne avec un très beau jardin",B1
Nous avons de nouveaux amis et nous avons rencontré nos voisins lors d’une soirée festive la semaine dernière,B1
"J’ai fait de gros progrès en français, je le comprends et je sais le parler et l’écrire bien mieux maintenant",B1
Je suis dentiste dans un nouveau cabinet depuis une semaine et j’aime mon travail,B1
Mes collègues sont gentils et m'ont bien accueillie,B1
"Comme c'est proche de la maison, je peux y aller à pied, c’est très agréable",B1
Mon mari a enfin trouvé une place d’architecte et travaille sur un important projet d’immeuble avec son équipe,B1
"Les enfants travaillent bien à l’école, même si ma fille a quelques difficultés en mathématiques",B1
"Mon fils a de bonnes notes en français, c’est sa matière préférée",B1
"Il aime beaucoup lire, surtout le soir avant de dormir",B1
Ils se sont fait des copains et sont heureux de vivre en France,B1
Ils parlent encore mieux le français que nous,B1
Est-ce que ton mari et tes enfants vont bien,B1
Je suis heureuse de vous revoir le mois prochain,B1
Nous passerons les fêtes de Noël ensemble,B1
La fête de Pâques en France est une fête de tradition catholique,B1
Elle était selon la tradition précédée d’une période de jeûne de 40 jours appelée « Carême »,B1
"Durant cette période, les chrétiens ne mangeaient pas de viande, ni de plat très cher",B1
"Ils mangent plus simplement, en évitant les sucreries et les petits plaisirs",B1
"Il essaient également d’être plus raisonnés, plus généreux, moins centrés sur eux-mêmes",B1
Le jour de Pâques est le jour de la résurrection du Christ,B1
"Pour célébrer cet évènement exceptionnel, tous se réunissent et se retrouvent autours d’un copieux repas contenant de l’agneau (symbole de l’innoncence Du Christ)",B1
"Cette fête est encore traditionnellement fêtée en France, même si, comme pour Noël, elle a souvent perdu son aspect religieux",B1
La majorité des Français fête Pâques et considère cette date comme une occasion de se retrouver en famille pour partager un bon repas,B1
Les enfants aussi attendent avec impatience cette échéance,B1
"Ces chocolats, coulés en forme d’œufs, de lapins et de poules, sont souvent dispersés dans le jardin pour être retrouvés par les plus jeunes",B1
Je n'ai qu'un jour pour visiter Paris,B1
"Je suis l'itinéraire donné par Pierre, un ami français",B1
Je commence par un petit-déjeuner dans un café près de l'Arc de Triomphe avec des croissants délicieux,B1
"Après une marche sur les Champs-Élysées, je suis au pied de la Tour Eiffel",B1
Il y a beaucoup d'attente pour les ascenseurs (pour monter les étages) mais je suis enfin au sommet et peux apprécier la vue sur Paris,B1
"L'après-midi je me promène aux Tuileries, paradis de verdure au cœur de la capitale",B1
Je suis fatiguée et préfère prendre le métro pour aller à l'Île de la Cité,B1
"En visitant la cathédrale Notre-Dame de Paris je pense à Quasimodo, personnage du roman de Victor Hugo",B1
"Encore le métro, et je contemple la splendide façade de l'Opéra Garnier",B1
C'est le quartier des beaux magasins et des produits de grandes marques,B1
Je termine à Montmartre avec sa basilique et ses ruelles (petites rues),B1
"Après l'ambiance de luxe, ici c'est comme un tranquille village",B1
Je vais choisir un restaurant pour savourer un bon repas après cette journée bien remplie,B1
Je suis actuellement en vacances en Alsace,B1
Il fait très froid ici,A2
Hier il a même neigé,A2
"Aujourd'hui, avec ma famille (mes parents et mon frère) nous sommes allés au marché de Noël, c'était vraiment incroyable",B1
Ma mère m'a exceptionnellement laissé boire du vin chaud même si je n'ai normalement pas le droit,B1
"Dans ma famille, on adore goûter les spécialités locales alors on a tout essayé, de la choucroute à la tarte flambée en passant par les kouglofs",B1
Félix n'arrête pas de manger des bredele (des biscuits spéciaux d’ici),B1
C'est vrai qu'ils sont très bons mais j'ai peur qu'il tombe malade,B1
"Demain, on prévoit de faire une promenade dans le quartier de la Petite France, il paraît que c'est le plus beau de Strasbourg",B1
Je t'aurais bien envoyé une photo mais nous n'avons pas d'appareil,B1
"Mes parents ont insisté pour qu'on prenne nos chaussures de marche, ils veulent qu'on aille faire des randonnées dans les montagnes",B1
J'espère que tu vas bien et que tes vacances au ski se passent bien aussi,B1
"On se reverra à la rentrée, j'ai hâte de te raconter le reste de mon voyage",B1
"Jason, touriste américain, est en vacances en Provence et vient à Marseille une journée",B1
Il passe la matinée au Mucem qui est un musée récent et très connu,B1
Son architecture moderne s'associe très bien avec la mer toute proche et l'ancien Fort Saint-Jean,B1
Il fait une promenade sur le Vieux Port,B1
Il y a des marchands de poissons et c'est le départ de nombreux bateaux,B1
À midi il prend un sandwich dans un café,B1
Il n'est pas fatigué et décide de marcher jusqu'à Notre Dame de la Garde,B1
Cette basilique est célèbre à Marseille,B1
Du haut de cette colline la vue sur Marseille est remarquable,B1
"Maintenant Jason veut voir les plages du Prado, longues de plusieurs kilomètres",B1
"Après un trajet en bus, il est heureux de retrouver la mer",B1
Il enlève (ne garde pas) ses chaussures et marche longtemps au bord de l'eau,B1
La plage est pleine de Marseillais et de touristes,B1
"C'est vraiment génial d'être en ville et d'avoir les monuments, les musées et la plage au même endroit",B1
Jason a très faim et cherche un restaurant,B1
Il finit sa visite devant une assiette de bouillabaisse,B1
"C'est une soupe de poissons, spécialité de Marseille",B1
La secrétaire est restée au bureau toute la journée,B1
Son supérieur hiérarchique ne se plaint jamais d’elle,B1
Elle ne manque pas de dynamisme,B1
"Elle a remis de l’ordre sur son bureau, elle a envoyé des fax et répondu au courrier",B1
Elle a pris plusieurs rendez-vous pour le directeur,B1
Elle a préparé les photocopies pour les participants à la réunion de l’après-midi,B1
"Elle a remis des dossiers au chef du personnel, elle a rempli des formulaires et elle a rédigé plusieurs commentaires sur son rapport hebdomadaire",B1
"Enfin, elle s’est occupée du nouveau stagiaire et elle lui a expliqué le fonctionnement de l’entreprise ainsi que le règlement intérieur",B1
Quentin Danton et Vivien Bontemps vivent en province près de Valencienne,B1
"Habitant dans la même région, ils vont souvent boire un verre en ville",B1
"Vendredi soir, Vivien est venu voir Quentin avec une bonne bouteille de vin blanc",B1
"C’est son péché mignon ça, boire un bon verre de vin blanc",B1
"Mais, ce soir-là, Quentin était sorti",B1
"Il avait pris sa belle valise verte qu’il trimballe depuis vingt ans, pour passer cinq jours de vacances près de Vannes chez sa vieille amie Sylvaine qu’il voyait beaucoup avant de vivre à Valencienne",B1
Vivien était déçu,B1
Il a repris sa voiture et il est rentré chez lui pour boire son verre de vin blanc en prenant un bon bain bien chaud,B1
Vivre à la campagne a beaucoup d’avantages,B1
Il n’y a presque pas de pollution,B1
Il n’y a pas beaucoup de voitures donc il n’y a pas d’embouteillage,B1
"La vie est plus saine, l’air est pur et la vie est moins chère qu’en ville",B1
Il y a aussi beaucoup d’avantages à vivre en ville,B1
"il y a du travail, des théâtres, des cinémas, la vie culturelle est riche",B1
"En ville, il y a des magasins, on peut rencontrer facilement d’autres personnes et c’est en ville qu’on trouve les meilleures écoles pour ses enfants",B1
"Assis en terrasse dans le quartier touristique du Vieux Lyon, James sirote une limonade bien fraîche",B2
"Avec la chaleur estivale, cette journée d’exploration se révèle très fatigante",B2
"Ce matin, James s’est levé tôt, a loué un vélo et a parcouru les rues de Lyon",B2
"Il a longé les quais de la Saône, traversé la presqu’île, puis rejoint les quais du Rhône",B2
"En chemin, il a pu admirer la magnifique fontaine Bartholdi sur la grande Place des Terreaux",B2
"Il s’est également arrêté dans une boulangerie où il a longuement hésité entre un pain au chocolat, un croissant, et une brioche aux pralines, pâtisserie typiquement lyonnaise",B2
Il a finalement opté pour cette dernière,B2
James a ensuite rejoint le quartier moderne de la Confluence où le fleuve de la Saône se jette dans le Rhône,B2
Il s’apprête maintenant à prendre le funiculaire qui l’emmènera au sommet de la colline de Fourvière,B2
"Là, il pourra visiter la fameuse basilique Notre Dame de Fourvière et contempler la splendide vue panoramique sur la ville de Lyon depuis le belvédère",B2
"En redescendant à pied, il s’arrêtera pour visiter le plus ancien théâtre gallo-romain de France, puis ira dîner dans un bouchon lyonnais, restaurant typique de la ville",B2
Tous ces préparatifs rendent chaque année l’atmosphère festive et enjouée,B2
Il n’y a qu’à observer la métamorphose des rues commerçantes pour en être convaincu,B2
"Finies les façades grises et ternes, terminée la morosité ambiante",B2
"Les passants semblent moins pressés, et s’attardent plus facilement devant une devanture ou dans les rayons",B2
Les dernières semaines avant Noël se déroulent dans une ambiance joyeuse et féérique,B2
Le 24 décembre est le jour du réveillon,B2
"C’est l’occasion de fêter Noël en famille, en petit comité",B2
"Un sapin fraîchement coupé est installé dans la cuisine ou le salon, et décoré à l’aide de guirlandes colorées et de boules de noël",B2
"Les cadeaux seront déposés à son pied, le soir du 24 ou le 25 décembre au matin",B2
"Le repas est servi sur une table resplendissante, recouverte de bougies et de petits santons",B2
"Le lendemain, le 25 décembre, est le jour de Noël",B1
C’est un jour de fête où l’on invite la famille plus éloignée à partager le repas de midi,B2
C’est souvent un repas fastueux et long,B2
il n’est pas rare de sortir de table vers 16 ou 17heures,B2
"Un lundi, Franck et Guillaume, qui travaillaient tous les dimanches comme extras dans un autre restaurant sur l’avenue, se sont rendus au chevet de leur grand-mère",B2
Celle-ci résidait désormais dans une maison de convalescence à quelques kilomètres au nord de la ville et s’est mise à guetter leur arrivée dès que le jour s’est levé,B2
"Eux, par contre, ont dû régler leur réveil",B2
"Ils sont descendus comme des zombis jusqu’au troquet du coin, ont bu deux ou trois cafés d’affilée, ont enfourché leur moto et sont venus se rendormir auprès d’elle sur d’affreux fauteuils de skaï noir",B2
"Quand on lui a amené son plateau-repas, la vieille dame, l’index sur la bouche, a indiqué, d’un mouvement de la tête, les deux gros bébés enroulés sur eux-mêmes qui lui tenaient compagnie",B2
Elle était heureuse,A2
Ils étaient là,A1
"Rien qu’à elle… Elle n’a pas osé appeler les infirmières pour qu’elles remontent son lit, a saisi sa fourchette délicatement et a mangé en silence",B2
"Elle a mis dans sa table de nuit, un morceau de pain, quelques portions de fromage et quelques fruits pour les leur donner quand ils se réveilleraient",B2
"Ensuite, elle a repoussé la tablette tout doucement et s’est croisé les mains sur le ventre tout en souriant",B2
"Ses yeux se sont fermés et elle a somnolé, bercée par le souffle de ses petits hommes et les débordements du passé",B2
"Ils s’étaient perdus tant de fois déjà… Elle avait passé sa vie, lui semblait-il, à les chercher…",B2
"Au fond du jardin, dans les arbres, chez la voisine, cachés dans une étable ou affalés devant la télévision, puis au café bien sûr, et maintenant sur des petits bouts de papier où ils lui avaient griffoné des numéros de téléphone qui n’étaient jamais les bons",B2
On est le quatorze juillet - chouette,B1
"Mais qu'est-ce que cela veut dire, en fait ?",B2
Et pourquoi est-ce que ces gens créent un poème aussi beau ?,B2
"Le quatorze juillet est la fête nationale de la France, le jour où les Français commémorent la prise de la Bastille qui a eu lieu en 1789",B2
"Même si la Révolution française était déjà en cours, la prise symbolique de la Juillet forteresse, qui ne comptait que 7 prisonniers à l'époque, reste l'événement clé de la révolte",B2
"En fin de compte, la Révolution a conduit au remplacement de la monarchie absolue par une monarchie constitutionnelle, qui, à son tour, sera remplacée par la Première République",C1
"Plus de royauté, plus de société d'ordres, plus de privilèges",B2
La Déclaration des droits de l'homme et du citoyen est un texte fondamental de la Révolution,B2
"À Paris, tous les 14 juillet, on organise un défilé militaire",B1
Des troupes armées étrangères sont parfois invitées à défiler aux côtés des armées françaises,B2
"La parade descend l'avenue Champs-Élysées, de la place de l'Étoile, alias place Charles-de-Gaulle, jusqu'à la place de la Concorde",B2
"Les militaires y saluent le Président de la République, son gouvernement, les principales autorités de l'État, le corps diplomatique ainsi que des personnalités politiques étrangères invitées pour l'occasion",B2
Des défilés sont également organisés dans d'autres villes de France avec des régiments locaux,B2
Comment bien faire sa valise qui tienne dans une cabine d'avion,B2
"Vous n'avez pas l'angoisse de vous la faire voler, et dès que vous arrivez à destination, vous l'emportez avec vous, et voilà, c'est fini",B2
"C'est dix kilos, et c'est vraiment de taille réduite, mais on peut parfaitement faire une valise pour une dizaine de jours, facilement, dans un volume réduit comme celui-là",B2
"Savoir exactement quelle sera la météo, quelles seront les soirées où vous devrez être habillée",B2
