Text,Difficulty
"Choisir des couleurs qui s'harmonisent entre elles, c'est-à-dire un spectre de couleurs qui va bien ensemble mais qui ne soit pas trop nombreux",B2
"Vous pouvez aujourd'hui associer le fuschia avec l'orange, vous pouvez faire tout noir et blanc, ou bien vous pouvez jouer une base bleu marine avec deux couleurs en plus",B2
"Je déconseille le blanc, les harmonies de blanc et le côté ivoire",B2
"ça, ça va quand on est à la maison, mais tous les blancs, ça exige tellement d'entretien et de lessives que ça n'en vaut la peine",B2
Et des tenues qui peuvent se moduler les unes avec les autres,B2
"Par exemple, choisissez deux pantalons, deux robes, mais allez-y franco sur le haut",B2
"Et surtout, essayez de limiter les paires de chaussures",B2
"Moi, j'ai toujours de la peine avec ça, mais il faut essayer d'éviter d'avoir plus de deux paires de chaussures dans une valise, parce que c'est lourd, ça prend de la place",B2
"Une seule paire pour le jour et le soir, c'est difficile, mais essayez de ne pas prendre plus de deux paires",B2
"Des semelles compensées, parce que les semelles compensées, ça flatte toujours la silhouette",B2
"Ensuite, si vous avez par exemple choisi des couleurs unies, vers les bleu marine, ou vers les noirs, il est indispensable d'avoir des accessoires pour relooker la tenue",B2
"Par exemple, porter une robe noire avec un foulard de couleur vive, fuschia ou orange ou rouge ou vert, et deux jours après, vous remettez cette robe noire avec d'autres bijoux, un gros collier",B2
"Vous faites oublier le foulard, et vous donnez l'impression d'avoir une autre tenue",B2
"Les broches également, très pratiques aussi, en les accumulant, et les petits boléros par-dessus",B2
"Un boléro que vous pouvez recycler tant sur le pantalon que sur une jupe, que sur une robe",B2
"Pour terminer, n'oubliez pas le maquillage",B1
"C'est ça qui est très important parce que si vous êtes belle, vous êtes surtout lumineuse et rieuse, donc il faut que vous vous sentiez à votre avantage",B2
"Donc n'hésitez pas à prendre du fond de teint en petits contenants, si jamais votre fond de teint est un gros truc de 100ml",B2
"Donc vous le recyclez dans une petite boîte que vous achetez chez Muji, chez H&M ou ailleurs",B2
"Une valise que vous n'avez pas besoin de mettre dans la soute, c'est beaucoup de stress en moins",B2
Lucie a postulé pour travailler comme monitrice dans un camp de vacances international cet été,B2
"Le directeur du camp, Monsieur Duteil, lui a demandé de lui fournir des renseignements supplémentaires, ce qu'elle fait dans l'email qui suit l'attention que vous portez à ma candidature",B2
J'espère que les informations qui suivent vous convaincront de m'embaucher,B2
"J'ai grandi dans une famille binationale, mon père est français et ma mère vient du Royaume Uni, donc je suis parfaitement bilingue",B2
"J'ai également étudié l'espagnol au collège et au lycée, et bien que je ne considère pas que je le parle couramment, je peux tenir une conversation sans problème",B2
"Depuis que je suis toute petite, je voyage beaucoup",B1
"D'abord avec ma famille, lorsque nous rendions visite à nos proches ou quand nous partions en vacances, puis plus tard avec mes amis, j'ai visité plus d'une dizaine de pays, dont l'Espagne, la Grèce, le Canada et la Tunisie",B2
"J'adore découvrir de nouvelles cultures, et la possibilité de travailler dans un cadre multiculturel est l'un des aspects les plus passionnants de ce poste de monitrice",B2
"Je me demandais également combien de postes étaient encore disponibles, et quand je pourrais espérer savoir si j'étais prise afin de pouvoir m'organiser en conséquence",B2
"J'espère avoir répondu à vos questions, et dans l'attente de votre décision, je vous prie d'agréer, Monsieur, mes salutations distinguées",B2
"Des vacances mémorables pour leurs cinq ans ensemble, Laurence et Arnaud se sont organisé des vacances de rêve",B2
"Ils ont tout planifié six mois à l'avance, afin de bénéficier des tarifs les plus avantageux, ce qui leur a permis par exemple de réserver un hôtel quatre étoiles au lieu de trois",B2
"Le dernier soir, ils avaient réservé une table dans un des restaurants les plus romantiques de Florence, histoire de finir leur séjour en beauté",B2
"Le cadre était enchanteur, la nourriture exquise, et on ne pouvait rêver meilleure soirée pour clôturer des vacances idylliques",B2
"Mais Laurence ne s'attendait pas du tout à ce que, vers la fin du repas, Arnaud se lève soudainement et qu'il s'agenouille devant le restaurant tout entier qui s'était naturellement tourné vers eux",B2
"Heureusement pour lui, les larmes qui embuaient les yeux de Laurence reflétaient sa joie, tout comme son sourire radieux",B2
"Evidemment, elle a dit oui, bien que personne à part Arnaud n'ait pu l'entendre, tant l'émotion lui serrait la gorge",B2
"Ils auraient voulu que ces vacances ne finissent jamais, mais ils rentrés des souvenirs plein la tête",B2
"Ce que Laurence ne savait pas, c'est qu'Arnaud avait prévu de profiter de ce voyage pour la demander en mariage",B2
Salut tout le monde,A1
"Je suis sûre que vous mouriez tous d'envie de savoir comment ma rentrée s'était passée, et je me suis dit qu'une petite mise à jour s'imposait",B2
"Ça fait maintenant deux semaines que j'ai repris les cours, et je prends petit à petit mes marques",B2
"Bien qu'il m'arrive encore de me tromper de couloir ici ou là, dans l'ensemble, je me suis plutôt bien adaptée, et je dois avouer que j'adore mon nouveau lycée",B2
"Le bâtiment principal, qui vient d'être rénové, a l'air tout neuf et ils ont peint les mursen couleurs pastels",B2
C'est trop classe,B1
Je vous avais dit que j'avais un peu peur de ne pas être dans la même classe que mes meilleures amies,B2
"Eh ben, au final, c'est arrivé",B2
"Mais ne vous inquiétez pas pour moi, parce que dès le premier jour, j'ai rencontré une nouvelle fille, Samia, dont je suis vite devenue inséparable",B2
"On aime le même type de musique, on regarde les mêmes séries et même nos sacs sont de la même couleur",B2
"Ben là aussi, il y a du bon et du moins bon",B2
Commençons par le bof,B2
"Elle n'a vraiment pas l'air commode, et elle nous a déjà annoncé qu'on aurait un test à la fin du mois de septembre",B2
Ça promet,B1
"En revanche, j'ai carrément le béguin pour le prof de français",B2
"Il est trop mignon, et il arrive à rendre les leçons super intéressantes avec un peu d'humour au second degré",B2
Je sens que je vais faire des progrès cette année,B2
"Enfin, pour ce qui est de mon emploi du temps, bon, ce n'est pas le monde des licornes, mais encore une fois, ça aurait pu être bien pire",B2
"Et donc, deux semaines après la rentrée, je suis plutôt satisfaite de ce début d'année, et j'ai hâte de voir ce que la suite me réserve",B2
Les Américains ont bien de la chance,B1
"Avec son repas en famille autour de sa traditionnelle dinde farcie, Thanksgiving est considérée comme une fête aussi importante que Noël aux États-Unis et au Canada",B2
"Mais quelle est l'histoire de cette fête, que signifie-t-elle et pourquoi ne se célèbre-t-elle pas à la même date au Canada et aux États-Unis d'Amérique",B2
"En 1620, le Mayflower - un bateau venu d'Europe - accoste dans une zone inconnue qui deviendra beaucoup plus tard la ville de Plymouth dans le nord des États-Unis actuels",B2
À bord : des pèlerins appartenant à la secte des Puritains,B2
"Soumis à des persécutions en raison de leur confession protestante, ils espèrent pouvoir vivre leur foi librement",B2
"Mais ils sont arrivés en plein hiver, au mois de décembre 1620, et ne sont ni de grands agriculteurs ni de grands chasseurs",B2
"Au printemps 1621, la moitié de ces pèlerins sont morts",B2
"Quand le printemps arrive, les survivants comprennent qu'ils doivent se constituer des réserves pour survivre au prochain hiver",B2
C'est au premier temps de la colonisation du continent américain par les colons européens au XVIIe siècle qu'il faut remonter pour comprendre cette fête si particulière,B2
"Sans les Wampanoag, les pèlerins auraient sans doute tous péri, comme ce fut le cas de bien d'autres à l'époque",B2
"Le gouverneur de la colonie, William Bradford, décida alors de proclamer un jour de remerciement et d'action de grâce pour remercier Dieu de leur avoir donné une terre finalement si accueillante avec des indigènes si serviables",B2
"Les pèlerins partagèrent alors cette célébration avec leurs voisins indiens, et ceux-ci apportèrent alors des dindes à rôtir",C1
"Selon la légende, Thanksgiving, qui veut dire littéralement en anglais « merci pour le don », est née ce jour-là à l'aube du deuxième hiver en Amérique des colons du Mayflower en 1621",B2
"Pour d'autres, l'origine remonte à 1623",B2
"En raison de la sécheresse qui a réduit les récoltes, le même gouverneur Bradford proclame une journée de jeûne et de prière",B2
La pluie vient arroser les champs et sauve ainsi la colonie d'un grand malheur,B2
Bradford annonce alors un jour de remerciement à Dieu,B2
"Cette deuxième explication plus tardive semble avoir l'avantage pour certains de retirer les Amérindiens de l'équation, ce qui entache d'autant sa crédibilité",B2
"Ce qui est sûr, c'est que cette tradition ne s'est vraiment ancrée dans les coutumes américaines qu'en 1863, lorsque le président Lincoln désigne ce jour, le quatrième jeudi de novembre, comme une fête nationale",B2
"En fait, Thanksgiving est avant tout la survivance d'une vieille coutume païenne : la célébration de la fin des récoltes ou des vendanges que l'on retrouve sous différents noms dans toutes les cultures du monde",B2
"C'est pour ça qu'au Canada on célèbre Thanksgiving le second lundi d'octobre, date à laquelle les récoltes sont achevées, puisque étant plus au nord, l'hiver arrive ici plus vite",B2
"Aux États-Unis, on fêtera Thanksgiving le quatrième jeudi de novembre",B2
"La tradition nord-américaine veut qu'on se retrouve en famille pour manger une dinde farcie accompagnée d'une purée de pommes de terre, de patates douces, d'une gelée de canneberges et une tarte à la citrouille",B2
"D'ailleurs, les Américains qui mangent de la dinde sont si nombreux que cette journée est également appelée le jour de la dinde",B2
"Cette voix, tous les voyageurs la connaissent",B2
"Simone est comédienne, mais deux fois par mois, elle vient au siège de SNCF pour enregistrer ses annonces",B2
"Eh bien voilà, bienvenue dans mon studio",B1
"Déjà, Dominique, avec qui je travaille",B1
"Donc, lorsqu'il en a suffisamment, il m'appelle, et à ce moment-là, je viens faire une séance",B2
"Et j'ai toutes ces feuilles devant moi, et je parle",B2
"il y en a pour la téléphonie, pour les gares, pour l'intérieur des trains",B2
"Simone ne compte pas arrêter son activité, mais le jour où ça arrivera, SNCF a déjà numérisé sa voix pour pouvoir continuer de l'utiliser encore longtemps après",B2
"C'est un dialogue, ce genre de serveur vocal",B2
"Avec l'arrivée du numérique, le métier de Simone n'est plus le même que celui d'il y a 30 ans",B2
"La voix préfère en rire, et apprécie toujours autant son travail",B2
"Alors, il y a longtemps, on enregistrait les phrases dans leur globalité",B2
"Puis, l'informatique est arrivé et petit à petit, nous avons commencé à enregistrer effectivement des petites phrases, des groupes de mots, voire même des mots, qui ensuite sont collés les uns aux autres",B2
"Quand c'est sérieux, elle ne sourit pas, elle est sérieuse, mais là en l'occurrence, c'est plutôt convivial, on est plutôt proches des gens, on discute avec eux",B2
"Voie 3, le TGV à destination de Marseille Saint Charles va partir",B2
Prenez garde à la fermeture des portes,B2
Attention au départ,A2
SNCF vous souhaite un agréable voyage,A2
"Être voix de SNCF, c'est un travail au quotidien",B2
Simone doit exercer sa voix pour rester constante,B2
"Les cordes vocales, ce sont des muscles, hein, et donc, j'ai un entraînement quotidien parce qu'on doit être raccord avec des enregistrements qui ont quelquefois 10 voire 15 ans",B2
Je fais des exercices d'articulation,B2
"Généralement, quand j'arrive quelque part, sur le chemin, je dis",B2
"Elle sourit tout le temps, c'est un sourire qu'on entend dans les annonces",B2
"On a toujours l'impression qu'il y a quelqu'un à côté d'elle, qu'elle s'adresse à quelqu'un",B2
"Voilà, et alors donc je me cache parce que dans la rue, on me regarde, on me prend pour une folle, alors je mets ma main comme ça",B2
On a cette chance d'avoir Simone,B2
"C'est vrai que c'est quelque chose d'assez unique, hein, je crois qu'il n'y a pas d'autre entreprise ferroviaire, ou même dans le monde du transport, qui a l'équivalent",B2
"Pour lui, c'est l'identité sonore de l'entreprise",B2
Dominique apprécie de travailler avec Simone,A2
"Comme tous les soirs, c'est moi Monsieur Stopeleu pour vous présenter le journal Alsace, avec des nouvelles du Haut-Rhin, des nouvelles du Bas-Rhin des nouvelles aussi du bas du dos, tant qu'on y est",C1
"Mais soyons sérieux, nouvelles en bref : économie",C1
"Bon résultat de l'économie française ce mois-ci, plus quatre pour cent",C1
"Faut dire que si on enlève les résultats de l'Alsace, les autres départements, ils sont largement en déficit",C1
Soyons sérieux,B2
"Ça veut dire ""Sapeurs-Pompiers""",C1
"Faits divers, faits divers, alors qu'on est au printemps, faits divers alors qu'on est au printemps - ""d'hiver""",C1
Elle est connue mais ça fait toujours rigoler,C1
La petite fille de Habsheim-le-Haut qui avait disparu il y a trois jours a en fait été retrouvée saine et sauve par les pompiers,C1
"Ces derniers ont eu la bonne idée de faire les recherches à Habsheim-le-Bas, à 200 mètres plus loin",C1
"En fait, pour ceux qui sauraient pas, vous savez pourquoi il y a écrit S et P sur les voitures de pompiers ?",C1
"Non, ça veut dire ça brûle",B2
"Ah, ça fait toujours rigoler",C1
"Ah, ça c'est moins drôle : augmentation ce mois-ci encore du chômage en Alsace",C1
"En effet, Monsieur Helmut Kohl donne priorité aux Allemands de l'Est.",C1
"Si, il va falloir maintenant qu'on trouve du boulot en France.",C1
On n'est sortis de l'auberge,C1
Ça c'est sûr,C1
"Parce que, Monsieur Rocard il n'arrête pas de nous raconter des salades",C1
"Ah non, c'est avec Cresson que c'est plus rigolo",C1
"Et bonne humeur pour finir, avec la charade habituelle du soir",C1
"Mon premier est un champion de ski français très renommé, mon deuxième est un champion de ski français encore très renommé, et mon tout, c'est pour faire rire les petits enfants",C1
"Ce soir, c'est le grand soir",C1
"Je dois tout donner, je n'ai pas le droit à l'erreur",C1
"Restaurant classe, costar, peaufinage du regard de séducteur, on part sur un sans-faute",C1
J'avais lu dans un bouquin que chaque geste lors d'un premier rendez-vous n'était pas anodin,C1
Il suffisait juste de savoir les interpréter,C1
"Aah, la voilà",C1
Soyons réceptif,C1
"Une belle robe moulante, elle veut mettre en avant ses formes",C1
Je suis vraiment désolée pour le retard,B2
"Elle pose sa main sur la table, elle tente un rapprochement",C1
"Un regard vers le ciel, elle s'inspire, elle se projette",C1
"Elle se touche les cheveux, un classique, elle me désire",C1
"Elle se ronge les ongles, ça veut dire qu'elle est anxieuse",C1
"Elle se cure le nez, ça veut dire qu'elle est dégueu",C1
"Ça y est, elle est prête",C1
mais je m'égare,C1
Où en étions-nous ?,C1
"Qu'est-ce qu'il nous arrive, Natacha ?",C1
"Si elle se touche les lèvres, ça veut dire qu'elle m'envie",C1
"Je vais te faire voyager, tu les reverras ces plages de sable blanc sur lequel tu aimais courir avec tes parents avant d'aller manger des churros sur le port mais je m'égare encore",C1
Qu'est-ce qu'il m'arrive ?,C1
"Si elle me parle, c'est qu'elle a des choses à dire, il faut que je l'écoute",C1
"Si elle sourit, ça veut dire que je lui plais, il faut que je sourie",C1
"Si elle se touche l'oreille, il faut que je me touche l'oreille",C1
"Si elle cligne des yeux, ça veut dire qu'il faut que je cligne des yeux",C1
"Si elle se mordille les lèvres, je dois lécher les miennes",C1
"Le coup de la bretelle qui tombe, je vais la mettre à l'aise",C1
"Elle boit de l'eau, elle a chaud, c'est vrai qu'il fait chaud",B2
"Elle me touche la main, ça veut dire qu'il faut que je lui touche les seins",C1
"Non, mais c'est, c'est les femmes, en fait, hein",C1
"Ça, ça pour allumer il y a du monde mais euh, pour éteindre le feu, il n' y a plus personne",C1
"Comme ça, du jour au lendemain, ma routine a été complètement bouleversée, et je ne sais plus quoi penser",C1
"Avant, ma vie était parfaite",B2
"Le matin, je me réveillais avec mon humain, Arthur, puis nous allions courir dans le quartier, avant de rentrer prendre notre petit-déjeuner",C1
"Et après ça, j'avais l'appartement rien qu'à moi",C1
C'était le paradis,C1
"Je faisais de longues siestes tantôt sur le canapé, tantôt sur le lit d'Arthur, à la chaleur du soleil ou du radiateur selon les saisons",C1
"Puis je me bagarrais avec Daffy, mon canard en peluche, je mâchouillais mon os qui couine ou je chantais à l'unisson avec la radio de la voisine",C1
Je pouvais faire autant de bruit que je voulais,C1
"Quand Arthur rentrait enfin, je lui faisais la fête en sautant dans tous les sens, et il me sortions pour notre promenade au parc, caressait derrière les oreilles en ria Ensuite, nous où nous retrouvions quelques amis",C1
"Pendant que les humains bavardaient, Mimi le caniche, Fido le berger allemand et moi, on se donnait les nouvelles du quartier et on reniflait les nouveaux arrivants",C1
"Après dîner, Arthur me donnait souvent une petite friandise avant de ressortir, et je m'assoupissais tranquillement dans mon panier",C1
"Mais ça, c'était avant",C1
"Maintenant, le matin, c'est moi qui dois réveiller mon humain, et parfois il se lève plusieurs heures en retard",C1
Notre jogging matinal est devenu une course d'obstacles où on évite tous les autres passants,C1
C'est très fatigant et agaçant,C1
"Mais surtout, après le petit-déjeuner, Arthur ne s'en va plus",C1
Finies mes journées tranquilles,C1
"II s'installe à la table et tapote plein de petits boutons devant une mini télé; et dès que je commence à m'endormir, il se met à parler à d'autres minis humains dans la télé",C1
"La cerise sur le gâteau, c'est que je n'ai plus le droit de jouer avec mon os qui couine, et Daffy et moi ne pouvons plus nous battre en paix sans être interrompu par mon humain",C1
Et je ne vous ai pas encore parlé des promenades,B2
"Oui, j'ai bien dit les promenades, parce que nous sortons à présent toutes les deux heures en moyenne",C1
Je suis sur les rotules,C1
Et je ne peux même pas en profiter pour discuter avec Mimi et Fido,C1
"En effet, bien que je n'aie jamais vu autant d'humains et leurs chiens dans les rues, on ne s'arrête plus pour bavarder, et on est trop loin les uns des autres de toute façon",C1
"Du coup, je suis obligée de crier pour leur dire bonjour de l'autre côté de la rue",C1
Quelle situation étrange,C1
"Autant vous dire qu'à la fin de la journée, je ne rêve que d'une chose : mon panier",C1
"Bon, il y a quand même de bons côtés à ce nouveau rythme",C1
"Tous les soirs, mon humain et moi nous installons sur le canapé, et il me fait des câlins en regardant la télé jusqu'à ce que je m'endorme la tête sur ses genoux",C1
On boira des cocktails en entamant les boîtes de chocolats en forme de coeur que j'aurai achetées pour l'occasion,C1
"Cette année, pour la première fois en cinq ans, je serai célibataire pour la Saint-Valentin",C1
"Pour être honnête, ça ne me dérange pas du tout",C1
"J'ai toujours trouvé cette fête assez artificielle, mais pour une fois, j'ai vraiment hâte d'y être",C1
"En effet, avec mes autres copines célibataires, on a décidé d'en faire une célébration de notre amitié",C1
"On se rejoindra toutes chez moi où on échangera des cartes et des fleurs : après tout, pourquoi n'y aurait-on pas droit, nous aussi ?",C1
"Ensuite, on ira au cinéma du quartier qui organise tous les ans des séances spéciales",C1
"Cette année, ce sera une séance karaoké géant de Moulin Rouge, ce qui tombe super bien, vu que c'est notre film culte",C1
"On connaît toutes les chansons par coeur, et on a déjà choisi nos costumes de danseuses de cancan, avec lesquels on a bien l'intention de remporter la compétition du meilleur costume",C1
"Après nous être époumonées sur ""Come what may"", et après avoir bavé sur le beau Ewan McGregor, on sautera dans un Uber pour continuer la soirée dans notre club préféré qui, lui aussi, aura un thème spécial",C1
"On dansera sur les tubes du Club Dorothée et ""Le Prince de Bel Air""",C1
"Et avec nos tenues, on est sûres de se faire remarquer",C1
Maintenant vous comprenez mon excitation,B2
Qui a besoin d'un homme avec un programme pareil ?,C1
Enfin la délivrance après soixante-quatorze jours d'une régate exceptionnelle,C1
Armel Le Cléach arrive cet après-midi au large des Sables d'Olonne,C1
"Temps de course : soixante-quatorze jours, trois heures, trente-cinq minutes, quarante-six secondes",B2
"""J'ai rien lâché, pas un mètre",C1
"C'était, euh, chaque mètre gagné c'est dur, et puis euh, je la voulais tellement cette victoire",C1
"Elle est belle, cette victoire pour ce skipper de trente-neuf ans",C1
"C'est aussi le terme d'une quête qui a duré presque dix ans, en terminant deux fois à la deuxième place du Vendée Globe",C1
La huitième édition sera la bonne,C1
"Une huitième édition dominée par le duel au sommet avec Alex Thomson, une course poursuite menée par Armel depuis le 23 novembre dernier, quarante-sept jours de haute tension qui se terminent aujourd'hui",C1
"J'avais l'impression que tout était contre moi, et puis euh, je me suis accroché, et puis voilà c'est la fin, j'étais content, je me suis bagarré, j'ai eu beaucoup de soutien à terre, tous les gens qui m'envoyaient des messages, qui me disaient de rien lâcher",C1
"il faisait partie des prétendants sérieux, je savais qu'il avait de nombreux atouts et voilà",C1
"Moi, j'ai, c'est sûr que c'est un concurrent très redouté et redoutable, euh, et il a eu, euh, il a eu des bonnes conditions météo dans l'Atlantique pour revenir, qui lui ont permis de revenir sur la bagarre",C1
Je pensais avoir vraiment fait le trou suffisant,C1
"au Cap Horn, et c'était pas le cas et c'est vrai que bah jusqu'au bout il a fallu s'accrocher",C1
"Direction Petit Bourg, en Guadeloupe",C1
"33° à l'ombre, et 80% d'humidité, aujourd'hui, c'est au ceur du jardin tropical de Valombreuse que nous vous proposons de découvrir l'une des spécialités culinaires les plus consommées aux Antilles : les accras de morue",C1
"De délicieux petits beignets tendres et croustillants à la fois, une recette idéale pour voyager sous le soleil des tropiques",C1
"S'il existe des dizaines de variantes à cette recette, le chef Gérard- Michel Corbin nous propose d'y apporter lui aussi sa touche personnelle",C1
"J'ai toujours été très déçu par la texture des accras qu'on me proposait car on avait quelque chose souvent de gras, de spongieux, de pas très très agréable en bouche et surtout avec trop peu de morue à mon goût",C1
"J'adore la morue, et pour moi, l'accra de morue c'est les accras avec de la morue dedans",C1
"Originaire des Saintes, un archipel situé au sud de la Guadeloupe, Gérard-Michel a un parcours pour le moins atypique",C1
"Après 22 ans de vie parisienne, cet ancien designer-graphiste a décidé de se consacrer à sa passion de toujours : la cuisine",C1
"J'ai été effectivement formaté, on va dire, depuis tout petit par d'abord ma grand-mère qui était une vraiment une fine cuisinière, d'origine saintoise",C1
"Elle a transmis effectivement, ben, ce savoir à ma maman",C1
"Moi, tout naturellement, depuis l'âge de 13 ans, je l'ai quand même pas mal piratée",C1
"J'étais toujours dans ses jambes, effectivement, à goûter tous ses plats",C1
"dès qu'elle avait le dos tourné, je soulevais le capot et j'en mangeais une partie",C1
Ça a développé je pense instinctivement et naturellement ma créativité en cuisine,C1
"Allez, il est temps de s'attaquer à notre recette du jour, les fameux accras de morue",C1
"Très présente dans l'alimentation antillaise, la morue a été introduite aux Petites Antilles par les premiers colons",C1
"C'est un poisson, donc, qu'on faisait venir aux Antilles ou fumé, ou salé, pour des raisons de conservation, parce qu'à l'époque on n'avait pas de frigidaire, on n'avait pas de frigo, on n'avait pas de chambres froides, donc la seule façon de conserver les aliments c'était de les saler, ou de les sucrer, ou de les mettre à l'huile",C1
"Donc, effectivement, donc, historiquement, la morue qu'on appelle morue d'ailleurs uniquement quand elle est salée, sinon c'est du lieu ou du colin et c'est donc effectivement une denrée qu'on trouvait quasiment partout, parce que c'était vraimen base de l'alimentation",C1
"La base de l'alimentation, mais aussi la base de notre recette du jour",C1
"Première étape incontournable, dessaler la morue en la plongeant 20 minutes dans un grand volume d'eau bouillante",C1
"Une opération à renouveler 2 à 3 fois, avant de l'émietter le plus finement possible, la chiquetailler, comme on dit aux Antilles",C1
